id,question,answer,answerable,category,relevant_ids,source
1884,"Ralph watches TV for 4 hours a day from Monday to Friday, and 6 hours a day on Saturday and Sunday. How many hours does Ralph spend watching TV in one week?",[32.0],True,,,GSM8K
512, A toy store had 6 giant stuffed bears in stock when they got another shipment with 18 bears in it. The put the bears onto shelves with 6 on each shelf. How many shelves did they use? ,[4.0],True,,,MultiArith
1755,Max has 8 children and each of his children has the same number of children as he does except for 2 who have 5 children each. How many grandchildren does he have?,[58.0],True,,,GSM8K
1545,"Mindy has 7 less than 9 times as many emails waiting for her as phone messages. If she has a total of 93 emails and phone messages combined, how many emails does she have?",[83.0],True,,,GSM8K
2113,"Greg bought a 20-pack of granola bars to eat at lunch for the week. He set aside one for each day of the week, traded three of the remaining bars to his friend Pete for a soda, and gave the rest to his two sisters. How many did each sister get when they split them evenly?",[5.0],True,,,GSM8K
5003,The second angle of a triangle is five times as large as the first. The measure of the third angle is 12 degrees greater than that of the first angle..How large are the angles?,[24.0],True,,,ASDiv
1214,"James decides he needs to start eating more vegetables.  He starts by eating a quarter pound of asparagus and a quarter pound of broccoli per day.  After 2 weeks, he doubles that amount and adds 3 pounds of kale per week.  How many pounds of vegetables does he eat a week after adding the kale?",[10.0],True,,,GSM8K
2054,Baez has 25 marbles. She loses 20% of them one day. Then a friend sees her and gives her double the amount that Baez has after she lost them. How many marbles does Baez end up with?,[60.0],True,,,GSM8K
5049,"Lexie's younger brother helped pick up all the paper clips in Lexie's room. He was able to collect 81 paper clips. If he wants to distribute the paper clips in 9 boxes,.how many paper clips will each box contain?",[9.0],True,,,ASDiv
493,There are 384 oranges and 192 bananas in Philip's collection. If the bananas are organized into 345 groups and oranges are organized into 16 groups.How big is each group of oranges?,[24.0],True,,,SVAMP
539, Roger had 16 dollars. For his birthday he got 28 more dollars but spent 25 on a new game. How much money does he have now? ,[19.0],True,,,MultiArith
268,Baker made 126 cakes and 48 pastries. If he sold 115 cakes and 81 pastries.How many more cakes than pastries did baker make?,[78.0],True,,,SVAMP
98,"19 red peaches, 11 yellow peaches and 12 green peaches are in the basket..How many more red peaches than yellow peaches are in the basket?",[8.0],True,,,SVAMP
1445,"Max fills up water balloons for 30 minutes at a rate of 2 water balloons every minute. Max’s friend Zach fills up water balloons for 40 minutes at a rate of 3 water balloons every minute. In the process, 10 of the water balloons pop on the ground. How many filled water balloons do Max and Zach have in total?",[170.0],True,,,GSM8K
355,After Jessie started to go jogging everyday she lost 35 kilograms. She weighed 69 kilograms before beginning jogging..How much does she weigh now?,[34.0],True,,,SVAMP
1636,"Peter has to walk 2.5 miles to get to the grocery store. If it takes him 20 minutes to walk one mile and he has walked 1 mile already, how many more minutes does he have to walk to reach it?",[30.0],True,,,GSM8K
983,"Four days' temperatures were recorded for Wayupnorth, Canada. The temperatures were: -36 degrees Fahrenheit, +13 degrees Fahrenheit, -15 degrees Fahrenheit, and -10 degrees Fahrenheit. What was the average number of degrees (Fahrenheit) in Wayupnorth, Canada on the 4 days recorded?",[-12.0],True,,,GSM8K
400,There were 5 roses and 3 orchids in the vase. Jessica cut some more roses and orchids from her flower garden. There are now 12 roses and 2 orchids in the vase..How many more roses than orchids are there in the vase now?,[10.0],True,,,SVAMP
631, George had 30 dollars. For his birthday he got 16 more dollars but spent 38 on a new game. How much money does he have now? ,[8.0],True,,,MultiArith
668, A pet store had 12 siamese cats and 20 house cats. During a sale they sold 20 cats. How many cats do they have left? ,[12.0],True,,,MultiArith
1119,"Lisa has 18 more dresses than Ana. If the number of their dresses combined is 48, how many dresses does Ana have?",[15.0],True,,,GSM8K
2211,"Luke takes fifty more than five times as many grape jelly beans as vanilla jelly beans. If there are 120 vanilla jelly beans, how many jelly beans are there in total?",[770.0],True,,,GSM8K
404,Randy has 97 blocks. He uses some blocks to build a tower. If there are 72 blocks left.How many blocks did he use to build the tower?,[25.0],True,,,SVAMP
208,He then went to see the oranges being harvested. He found out that they harvest 66 sacks per day..How many oranges do they harvest per day if each sack contains 28 oranges?,[1848.0],True,,,SVAMP
901,"Jessica is making an apple pie. She knows that each serving requires 1.5 apples and she has 12 quests. She plans to make 3 pies, which each contain 8 servings. If her guests finish all the pie, on average , how many apples does each guest eat?",[3.0],True,,,GSM8K
1738,"Angela wants to check her math homework answers with her friends, but some of them aren't done yet. Out of 20 problems, Martha has finished 2, Jenna has finished four times the number Martha did minus 2, and Mark has finished half the number Jenna did. If none of the friends worked on any of the same problems, how many problems have no one but Angela finished?",[9.0],True,,,GSM8K
1540,Carrie wants to buy a new iPhone. The new iPhone costs $800. She can trade in her Samsung Galaxy for $240. She can make $80 per week babysitting. How many weeks does she have to work before she can purchase the iPhone?,[7.0],True,,,GSM8K
438,In a school there are 706 girls and 222 boys. 418 more girls joined the school..How many pupils are there in the school now?,[1346.0],True,,,SVAMP
2499,"Jamie owns 4 Persian cats and 2 Maine Coons. Gordon owns half as many Persians and one more Maine Coon than Jamie. Hawkeye owns one less Maine Coon than Gordon and no Persian cats. If they bring all of their cats together to play, how many cats are there in total?",[13.0],True,,,GSM8K
550," There were 17 girls and 32 boys trying out for the schools basketball team. If only 10 of them got called back, how many students didn't make the cut? ",[39.0],True,,,MultiArith
639," Mike invited 13 friends to a birthday party, but 7 couldn't come. If he wanted to buy enough cupcakes so each person could have exactly 4, how many should he buy? ",[24.0],True,,,MultiArith
1273,Isabelle’s parents bought a new television for $480. The seller gives them a 5% discount. They pay a first installment of $150 and will pay the rest in 3 monthly installments. What is the amount of a monthly payment?,[102.0],True,,,GSM8K
1602,"Pat is hunting for sharks to take photos. For every photo he takes he earns $15. He sees a shark about every 10 minutes. His boat fuel costs $50 an hour. If he shark hunts for 5 hours, how much money can he expect to make in profit?",[200.0],True,,,GSM8K
1667,"Emmalyn decided to paint fences in her neighborhood for twenty cents per meter. If there were 50 fences in the neighborhood that she had to paint and each fence was 500 meters long, calculate the total amount she earned from painting the fences.",[5000.0],True,,,GSM8K
1804,James buys jars for his honey.  He has 5 hives that each produce 20 liters of honey.  Each jar can hold .5 liters.  How many jars will he need to buy if his friend is bringing his own jars for half the honey?,[100.0],True,,,GSM8K
1621,"Carol is an aviation engineer deciding how much fuel to put in a jet. The empty plane needs 20 gallons of fuel per mile. Each person on the plane increases this amount by 3 gallons per mile, and each bag increases it by 2 gallons per mile. If there are 30 passengers and 5 flight crew, and each person brought two bags, how many gallons of fuel does the plane need for a 400-mile trip?",[106000.0],True,,,GSM8K
1284,"Out of 480 employees, 10% got a salary increase while 20% got a travel allowance increase. How many employees did not get any increase?",[336.0],True,,,GSM8K
333,Paige was helping her mom plant flowers and together they planted some seeds. They put 10 seeds in each flower bed. If there are 45 flowerbeds.How many seeds did they plant?,[450.0],True,,,SVAMP
1125,"Robin wants to buy jelly bracelets for her friends. She decides to buy one bracelet for each letter of the first name of her friends. Her friends are Jessica, Tori, Lily and Patrice. If each jelly bracelet costs $2, what is the total she will spend in dollars?",[44.0],True,,,GSM8K
814,"The local school is holding a big fair to raise money for 5 classes that want to go on a trip. 150 people came to the party and paid a total of $368 for entrance tickets. There was a raffle which brought in $343. The sale of cakes and drinks brought $279. At the end of the fair, the principal of the school shared the money raised between the 5 classes. How much money did each class receive?",[198.0],True,,,GSM8K
2052,"3 people run for president.  John manages to capture 150 votes. James captures 70% of the remaining vote.  If there were 1150 people voting, how many more votes did the third guy get than John?",[150.0],True,,,GSM8K
23,Robin cut off 20 inches of his hair. If his hair is now 10 inches long.How long was his hair before he cut?,[30.0],True,,,SVAMP
1305,"Shawn collected 40 plain pebbles. He painted 9 pebbles red and 13 pebbles blue. He then divided the remaining pebbles equally into 3 groups, and painted them purple, yellow, and green. What is the difference between the number of blue and yellow pebbles?",[7.0],True,,,GSM8K
613," For Halloween Katie and her sister combined the candy they received. Katie had 10 pieces of candy while her sister had 6. If they ate 9 pieces the first night, how many pieces do they have left? ",[7.0],True,,,MultiArith
2089,"Nadine's dog rolls around in the mud. She spends 10 minutes hosing him off outside, then shampoos him three times, which takes 15 minutes per shampoo. How long does she spend cleaning her dog total?",[55.0],True,,,GSM8K
2185,"Jared wants to watch a series with four episodes. The first three episodes are 58 minutes, 62 minutes, and 65 minutes long respectively. If the four episodes last 4 hours, how long is the fourth episode?",[55.0],True,,,GSM8K
757," While shopping for music online, Megan bought 2 country albums and 8 pop albums. Each album came with a lyric sheet and had 7 songs. How many songs did Megan buy total? ",[70.0],True,,,MultiArith
337,At the stop 13 more people got on the bus. Initially there were 4 people on the bus..How many people are there on the bus now?,[17.0],True,,,SVAMP
704, A store had 40 oranges in a bin. If they threw away 25 of the old ones and put 21 new ones in the bin how many would be in the bin? ,[36.0],True,,,MultiArith
226,The Razorback shirt shop makes $ 23 dollars off each shirt sold. During the Arkansas and Texas tech game they made $ 230 by selling shirts..How many shirts did they sell?,[10.0],True,,,SVAMP
1069,Roe saved $10 per month from January to July and saved $15 per month from August to November. How much should she save in December so she will have a total savings of $150 in the year?,[20.0],True,,,GSM8K
1040,There are three machines in a factory. Machine A can put caps on 12 bottles in 1 minute. Machine B can put caps to 2 fewer bottles than Machine A. Machine C can put caps to 5 more bottles than Machine B. How many bottles can those three machines put caps on in 10 minutes?,[370.0],True,,,GSM8K
835,"Bingo has two dogs. On average, they walk a total of 70 miles a week. The first dog walks an average of 2 miles a day. How many miles a day does the other dog average?",[8.0],True,,,GSM8K
1904,"In a fruit salad, there are raspberries, green grapes, and red grapes. There are seven more than 3 times the number of red grapes as green grapes. There are 5 less raspberries than green grapes. If there are 102 pieces of fruit in the salad, how many red grapes are in the salad?",[67.0],True,,,GSM8K
1474,"Nigel won $45 but gave some away. His mother gave him $80 more. If now Nigel has $10 more than twice the amount he originally had, how much money did he give away?",[25.0],True,,,GSM8K
5099,The angles of a triangle are in the ratio 1:2:3..Find each angle of the triangle.,[30.0],True,,,ASDiv
5028,Cory made 4500 g of candy. He saved 1 kg to eat later. He divided the rest of the candy over 7 bowls to serve at his party..How many grams of candy did Cory serve in each bowl?,[500.0],True,,,ASDiv
420,Matthew had 14 crackers and 21 cakes. If Matthew gave equal numbers of crackers and cakes to his 7 friends.How many crackers and cakes did each person eat?,[5.0],True,,,SVAMP
1048,"In a factory, there are 3 machines working 23 hours a day. The owner decided to buy a fourth machine, which works only 12 hours a day. One machine can produce 2 kg of material every hour. The factory sells the produced material for $50 per 1 kg. How much can this factory earn in one day?",[8100.0],True,,,GSM8K
5035,58 children are taking a bus to the zoo. They sit 2 children in every seat..How many seats will the children need in all?,[29.0],True,,,ASDiv
424,There are 141 pots. Each pot has 71 flowers and 91 sticks in it..How many flowers are there in all?,[10011.0],True,,,SVAMP
2077,"A Moroccan restaurant received 3 different shipments of couscous. The first two shipments of 7 and 13 pounds arrived on the same day. The next day's shipment was 45 pounds of couscous. If it takes 5 pounds of couscous to make a dish, how many dishes did the restaurant make?",[13.0],True,,,GSM8K
2325,How much money did you make if you sold 220 chocolate cookies at $1 per cookie and 70 vanilla cookies at $2 per cookie?,[360.0],True,,,GSM8K
5046,Finn has 89 goldfish. 32 of the goldfish die..How many goldfish are left?,[57.0],True,,,ASDiv
1060,Ten more than twice the number of birds on the fence is 50. How many birds are on the fence?,[20.0],True,,,GSM8K
602," At the arcade Victor won 46 tickets. If he spent 27 tickets on a beanie and later won 39 more tickets, how many would he have? ",[58.0],True,,,MultiArith
2287,"Sarah's age is equal to three times Mark's age minus 4. Mark is four years older than Billy. Billy is half Ana's age. If Ana will be 15 in 3 years, how old is Sarah?",[26.0],True,,,GSM8K
1479,"The mayor commissioned two artists to paint 50 murals around the city. Once the work was completed, Celina was paid $1,000 more than 4 times the amount Diego got. If the mayor paid the two a total of $50,000, how much did Diego get?",[9800.0],True,,,GSM8K
2249,"Martin is casting three bells for the church's belfry. The first bell takes 50 pounds of bronze, the second bell is twice the size of the first bell, and the third bell is four times the size of the second bell. How much bronze does he need total?",[550.0],True,,,GSM8K
843,Doris earns $20 per hour by babysitting. She needs to earn at least $1200 for her monthly expenses. She can babysit for 3 hours every weekday and 5 hours on a Saturday.  How many weeks does it take for Doris to earn enough to cover her monthly expenses?,[3.0],True,,,GSM8K
2414,Juvy has a garden that has 20 rows with 10 plants in each row. She plants parsley in the first 3 rows and rosemary in the last two rows. The rest of the rows will be planted with chives. How many chives will Juvy plant?,[150.0],True,,,GSM8K
608, A pet store had 36 siamese cats and 18 house cats. During a sale they sold 26 cats. How many cats do they have left? ,[28.0],True,,,MultiArith
1285,"Jasper will serve charcuterie at his dinner party. He buys 2 pounds of cheddar cheese for $10, a pound of cream cheese that cost half the price of the cheddar cheese, and a pack of cold cuts that cost twice the price of the cheddar cheese. How much does he spend on the ingredients?",[35.0],True,,,GSM8K
2482,"James runs a TV show and there are 5 main characters and 4 minor characters.  He pays the minor characters $15,000 each episode.  He paid the major characters three times as much.  How much does he pay per episode?",[285.0],True,,,GSM8K
654," Each chocolate bar in a box cost $3. If a box had 9 bars total and Wendy sold all but 3 bars, how much money would she have made? ",[18.0],True,,,MultiArith
2417,"Scott, Mary, and Ken committed to raising $4,000 for their local children’s cancer hospital. Right now, Mary’s collection is five times what Ken has, but three times Scott’s funds. If Ken has $600, by how much have the three exceeded their goal?",[600.0],True,,,GSM8K
680, John was selling his old games. He started out with 76 but sold 46 of them. He packed the rest up putting 5 games into each box. How many boxes did he have to use? ,[6.0],True,,,MultiArith
163,A waiter had 14 customers. 5 customers left..How many customers does he still have?,[9.0],True,,,SVAMP
1587,"Sally is selling boxes of crackers for her scout troop's fund-raiser. If she sells 50% more on Sunday than she sold on Saturday, then she'll have sold a total of 150 boxes on the two days. How many boxes did she sell on Saturday?",[60.0],True,,,GSM8K
1086,"Riku has 25 times more stickers than Kristoff. If Kristoff has 85 stickers, how many stickers does Riku have?",[2210.0],True,,,GSM8K
1462,"During a staff meeting, 50 doughnuts were served. If each of the 19 staff ate 2 doughnuts, how many doughnuts are left?",[12.0],True,,,GSM8K
1619,"On his farm, Mr. Valentino has 200 chickens, twice as many ducks as chickens and three times as many turkeys as ducks. How many birds does Mr. Valentino have on the farm in total?",[1800.0],True,,,GSM8K
5029,"For Halloween Isabel received sixteen pieces of candy from neighbors and five pieces from her older sister. If she only ate three pieces a day,.how long would the candy last her?",[7.0],True,,,ASDiv
58,An industrial machine can make 3 shirts a minute. It made 4 shirts yesterday and 8 shirts today..How many minutes did the machine work in all?,[4.0],True,,,SVAMP
1124,"Amanda needs 12 more marbles to have twice as many marbles as Katrina, and Mabel has 5 times as many marbles as Katrina. If Mabel has 85 marbles, how many more marbles does Mabel have than Amanda?",[63.0],True,,,GSM8K
2011,"Twice Betty's age is the cost of a pack of nuts. Doug, Betty's friend, is 40 years old. If the sum of their ages is 90, and Betty wants to buy 20 packs of the nuts, calculate the amount of money she'll pay for the packs of nuts.",[2000.0],True,,,GSM8K
1572,"Thomas is 6 years old. His older sister, Shay, is 13 years older than him and 5 years younger than their older brother, James. How old will James be by the time Thomas reaches his current age?",[42.0],True,,,GSM8K
2364,"This morning, farmer Rita's workers collected 30,000 gallons of milk and chilled it in a storage tank. They then spent the next 4 hours pumping milk at a rate of 2,880 gallons/hour from the storage tank into a milk tanker. For the next 7 hours, the workers added more milk into the storage tank, at a rate of 1,500 gallons per hour. How many gallons of milk were left in the storage tank?",[28.0],True,,,GSM8K
2280,"On a three-day trip, Wendy drove 125 miles on the first day, and 223 miles on the second day. How many miles did she drive on the third day, if the total miles that Wendy drove for the trip is 493 miles?",[145.0],True,,,GSM8K
1082,"Dana has 15 more pencils than Jayden, who has twice as much as Marcus. How many more pencils does Dana have than Marcus, if Jayden has 20 pencils?",[25.0],True,,,GSM8K
2225,"If there were 200 students who passed an English course three years ago, and each subsequent year until the current one that number increased by 50% of the previous year's number, how many students will pass the course this year?",[675.0],True,,,GSM8K
998,"All people named Barry are nice, while only half of the people named Kevin are nice.  Three-fourths of people named Julie are nice, while 10% of people named Joe are nice.  If a crowd contains 24 people named Barry, 20 people named Kevin, 80 people named Julie, and 50 people named Joe, how many nice people are in the crowd?",[99.0],True,,,GSM8K
1059,"A bag of pistachios has 80 pistachios in it.  95 percent have shells, and 75 percent of those have shells that are opened.  How many pistachios in the bag have shells and have an opened shell?",[57.0],True,,,GSM8K
1131,"In his first season at Best Hockey's team, Louie scored four goals in the last hockey match of this season. His brother has scored twice as many goals as Louie scored in the last match in each game he's played in each of the three seasons he's been on the team. Each season has 50 games.  What is the total number of goals the brothers have scored between them if, in the previous matches, Louie scored 40 goals?",[1244.0],True,,,GSM8K
738," Henry was helping the cafeteria workers pick up lunch trays, but he could only carry 9 trays at a time. If he had to pick up 29 trays from one table and 52 trays from another, how many trips will he make? ",[9.0],True,,,MultiArith
864,"Calum runs a nightclub and decides to run a disco night to attract different customers. He is planning the event and is calculating how much he can spend on each item without spending more than he has budgeted. He only needs to buy 4 disco balls and 10 boxes of food. Each box of food costs $25. Calum’s budget for the disco balls and food is $330. How much, in dollars, can Calum afford to spend on each disco ball?",[20.0],True,,,GSM8K
1230,"Max watches a show every day that airs from 2:00 pm to 2:30 pm and only airs during weekdays. If he watches every episode during the week but misses the Friday episode, how many hours of the show did he watch?",[2.0],True,,,GSM8K
1392,"Laura wants to bake a cake for her mother. She checks the recipe and the pantry and sees that she needs to buy 2 cups of flour, 2 cups of sugar, a cup of butter, and two eggs. The flour costs $4. The sugar costs $2. The eggs cost $.5, and the butter costs $2.5. When she is done baking it, she cuts the cake into 6 slices. Her mother enjoys a piece the first two days. But on the third day, they discover that Kevin, her dog, ate the rest of the cake. How much did the amount the dog ate cost?",[6.0],True,,,GSM8K
736," A new building needed 12 windows. The builder had already installed 6 of them. If it takes 4 hours to install each window, how long will it take him to install the rest? ",[24.0],True,,,MultiArith
1647,Fred had 212 sheets of paper. He received another 307 sheets of paper from Jane and gave Charles 156 sheets of paper. How many sheets of paper does Fred have left?,[363.0],True,,,GSM8K
516, The schools debate team had 11 boys and 45 girls on it. If they were split into groups of 7 how many groups could they make? ,[8.0],True,,,MultiArith
1076,Grandma wants to order 5 personalized backpacks for each of her grandchildren's first days of school.  The backpacks are 20% off of $20.00 and having their names monogrammed on the back pack will cost $12.00 each.  How much will the backpacks cost?,[140.0],True,,,GSM8K
1038,"John takes 3 days off of streaming per week.  On the days he does stream, he streams for 4 hours at a time and makes $10 an hour.  How much does he make a week?",[160.0],True,,,GSM8K
121,Tom had 36 cookies. He gave 14 cookies to his friend and ate 10 cookies..How many cookies did Tom have left?,[12.0],True,,,SVAMP
463,6 birds and 3 storks were sitting on the fence. 2 more storks came to join them..How many more birds than storks are sitting on the fence?,[1.0],True,,,SVAMP
213,"After eating a hearty meal they went to see the Buckingham palace. There, Rachel learned that 512 visitors came to the Buckingham palace that day. If there were 471 visitors the previous day and 808 visitors the day before that.How many visited the Buckingham palace within the past 89 days?",[1791.0],True,,,SVAMP
1297,The ratio of boys to girls at the dance was 3:4. There were 60 girls at the dance. The teachers were 20% of the number of boys. How many people were at the dance?,[114.0],True,,,GSM8K
356,Haley grew 20 trees in her backyard. After a typhoon 4 trees were left..How many trees died in the typhoon?,[16.0],True,,,SVAMP
2224,James spends 40 years teaching.  His partner has been teaching for 10 years less.  How long is their combined experience?,[70.0],True,,,GSM8K
900,John takes a pill every 6 hours.  How many pills does he take a week?,[28.0],True,,,GSM8K
1793,"Beth had 150 students in her 10th-grade class.  The following year 30 more students join.  In her final year, 15 students left.  How many students did Beth have in her class at the end of her final year?",[165.0],True,,,GSM8K
1088,"Amber is baking cakes for her party. She has invited 8 friends and each one will want two slices of cake. Each cake makes 6 slices. If she bakes 4 cakes, how many slices will be left over at the end if she eats three herself?",[5.0],True,,,GSM8K
913,"Reynald is the head of the varsity department, and he bought 145 balls. Twenty were soccer balls. There were five more basketballs than the soccer balls. Twice the number of soccer balls were tennis balls.  There were ten more baseballs than the soccer balls, and the rest were volleyballs. How many were volleyballs?",[30.0],True,,,GSM8K
164,Dan has $ 4. For a total of $ 3 he bought 10 candy bar each one costing the same amount of money..How much money is left?,[1.0],True,,,SVAMP
908,James decides to buy himself a new barbell.  It cost 30% more than his old $250 barbell.  How much did it cost?,[325.0],True,,,GSM8K
2236,"Mr Julien's store has 400 marbles remaining after the previous day's sales. Twenty customers came into the store, and each bought 15 marbles. How many marbles remain in the store?",[100.0],True,,,GSM8K
